ID,Slide,Tumor,Broad Category,Narrow Category,Question,A,B,C,D,Answer
749,TCGA-BH-A0BJ-01Z-00-DX1,BRCA,Diagnosis,Staging,Refer to the whole slide image and determine the pN stage for the lymph nodes based on the pathological findings presented.,pN0,pN1,pN2,pN3,B
750,TCGA-BH-A0BM-01Z-00-DX1,BRCA,Diagnosis,Disease Detection,"Based on the histological features observed in the provided whole slide image,does the patient have evidence of metastasis in the sentinel lymph nodes?",Yes,No,"Yes,but only micrometastasis",Evidence is inconclusive,A
751,TCGA-BH-A0BM-01Z-00-DX1,BRCA,Diagnosis,Grading,Analyze the provided whole slide image of breast carcinoma and determine the Nottingham grade.,Grade 1,Grade 2,Grade 3,Grade 4,A
752,TCGA-BH-A0BM-01Z-00-DX1,BRCA,Clinical,Treatment Guidance,"Based on the histopathological features observed in the provided whole slide image,what is an appropriate treatment option for the patient's breast cancer?",Hormone therapy with Tamoxifen,HER2-targeted therapy with Trastuzumab,Tyrosine kinase inhibitor therapy,Immunotherapy with Pembrolizumab,A
753,TCGA-BH-A0BP-01Z-00-DX1,BRCA,Diagnosis,Disease Classification,Which of these terms best describes the non-invasive component observed in the provided pathology slide image?,Lobular Carcinoma In Situ,Ductal Carcinoma In Situ,Adenosis,Papillary Carcinoma,B
754,TCGA-BH-A0BP-01Z-00-DX1,BRCA,Diagnosis,Grading,"Based on the histological features observed in the provided whole slide image,what is the Nottingham grade of the identified carcinoma?",Grade 1,Grade 2,Grade 3,Grade 4,B
755,TCGA-BH-A0BP-01Z-00-DX1,BRCA,Diagnosis,Staging,What is the pathological T stage (pT) of the invasive carcinoma as observed in the provided whole slide image?,pT1a,pT1b,pT1c,pT2,C
756,TCGA-BH-A0BQ-01Z-00-DX1,BRCA,Microscopy,Histopathological Changes,"Referencing the provided whole slide image,what type of histopathological change is identified in the DCIS component?",Infiltration,Apoptosis,Necrosis,Fibrosis,C
757,TCGA-BH-A0BQ-01Z-00-DX1,BRCA,Microscopy,Tissue Architecture and Arrangement,Examine the provided whole slide image. How is the spatial organization of DCIS represented?,Tubular and cribriform,Micropapillary,Solid pattern,Endocrine-like pattern,C
758,TCGA-BH-A0BT-01Z-00-DX1,BRCA,Diagnosis,Disease Classification,What type of carcinoma is identified in the breast tissue based on the histopathological features observed in the whole slide image?,Lobular carcinoma,Tubular carcinoma,Medullary carcinoma,Ductal carcinoma,D
759,TCGA-BH-A0BT-01Z-00-DX1,BRCA,Diagnosis,Disease Detection,Review the histological features in the provided whole slide image to determine if metastatic adenocarcinoma is present in the right sentinel lymph node #1.,Yes,No,Equivocal,Not applicable,B
760,TCGA-BH-A0BT-01Z-00-DX1,BRCA,Diagnosis,Grading,What Nottingham grade is assigned to the invasive ductal carcinoma observed in the provided whole slide image?,Grade 1,Grade 2,Grade 3,Grade 4,A
761,TCGA-BH-A0DH-01Z-00-DX1,BRCA,Diagnosis,Grading,Analyze the histopathological features on the whole slide image to determine the Nottingham score of the invasive ductal carcinoma. How is this score derived?,"8/9,determined by tubules,nuclei,and mitosis","6/9,determined by tubules,nuclei,and mitosis","5/9,determined by architectural patterns","9/9,determined by mitotic figures alone",B
762,TCGA-BH-A0DH-01Z-00-DX1,BRCA,Diagnosis,Staging,"Based on the histopathological features observed in the whole slide image,what is the T stage assigned to this invasive breast carcinoma?",pT1,pT2,pT3,pT4,B
763,TCGA-BH-A0DI-01Z-00-DX1,BRCA,Diagnosis,Disease Classification,"Based on the provided whole slide image of the right breast,identify the type of Ductal Carcinoma In Situ (DCIS):",Micropapillary,Cribriform and solid types with focal central necrosis,Apocrine,Comedo,B
764,TCGA-BH-A0DI-01Z-00-DX1,BRCA,Diagnosis,Grading,"Given the whole slide image and the Nottingham score components (tubule formation,nuclear atypia,mitotic activity),what grade is assigned to the invasive ductal carcinoma in the right breast?",Grade 1,Grade 2,Grade 3,Grade 4,B
765,TCGA-BH-A0DI-01Z-00-DX1,BRCA,Diagnosis,Staging,"Based on the provided image and staging information,what is the pathological stage of the invasive carcinoma in the breast?","pT1,pN0,pMX","pT2,pN1a,pM0","pT2,pN1a,pMX","pT3,pN0,pM1",C
766,TCGA-BH-A0DP-01Z-00-DX1,BRCA,Diagnosis,Disease Classification,"Based on the histological features observed in the provided whole slide image and the accompanying clinical information,what is the most likely diagnosis?",Invasive ductal carcinoma,Invasive lobular carcinoma,Medullary carcinoma,Mucinous carcinoma,B
767,TCGA-BH-A0DP-01Z-00-DX1,BRCA,Diagnosis,Grading,"Based on the whole slide image,which scoring component appears to contribute the least to the overall Nottingham score for this tumor?",Tubule formation,Nuclear grade,Mitotic activity,Lymphovascular invasion,C
768,TCGA-BH-A0DP-01Z-00-DX1,BRCA,Diagnosis,Staging,"Based on the analysis of the provided whole slide image,what is the pT stage of the tumor?",pT1,pT2,pT3,pT4,C
769,TCGA-BH-A0DP-01Z-00-DX1,BRCA,Microscopy,Tumor Characteristics,Which of the following features can be identified in the provided whole slide image of invasive lobular carcinoma?,High mitotic rate,Presence of signet ring cells,Well-formed tubules,Solid sheets of tumor cells,B
770,TCGA-BH-A0DT-01Z-00-DX1,BRCA,Diagnosis,Disease Classification,Which pattern is observed in the ductal carcinoma in situ (DCIS) in the provided whole slide image?,Comedo,Cribriform,Solid,Micropapillary,B
771,TCGA-BH-A0DT-01Z-00-DX1,BRCA,Diagnosis,Grading,What Nottingham grade can be assigned to the invasive ductal carcinoma based on the histopathological features observed in the whole slide image?,Grade 1,Grade 2,Grade 3,Grade 4,A
772,TCGA-BH-A0DT-01Z-00-DX1,BRCA,Microscopy,Histopathological Changes,Examine the provided whole slide image of non-neoplastic breast tissue and identify the histopathological change present.,Necrosis,Inflammation,Previous biopsy site changes,Papillary proliferation,C
773,TCGA-BH-A0DT-01Z-00-DX1,BRCA,Microscopy,Tissue Architecture and Arrangement,Examine the histological features of the non-neoplastic breast tissue and describe the tissue arrangement found.,Fibroadenoma formation,Hyperplasia,Infiltrating carcinoma,Sclerosing adenosis,A
774,TCGA-BH-A0DT-01Z-00-DX1,BRCA,Microscopy,Tumor Characteristics,Which of the following features of the tumor is NOT observed in the provided whole slide image?,Tubule formation,Lymphovascular invasion,Invasion to the anterior margin,Metastasis to lymph nodes,B
775,TCGA-BH-A0DZ-01Z-00-DX1,BRCA,Diagnosis,Disease Classification,Which of the following describes a specific histopathological feature observed in the whole slide image of the tumor in the right breast?,Extensive in situ component,Presence of comedonecrosis in ductal carcinoma in situ,Mixed ductal and lobular carcinoma,Intraductal papillary carcinoma,B
776,TCGA-BH-A0DZ-01Z-00-DX1,BRCA,Diagnosis,Grading,What degree of mitotic activity is observed in the infiltrating ductal carcinoma according to the Nottingham score based on the provided whole slide image?,1,2,3,4,B
777,TCGA-BH-A0DZ-01Z-00-DX1,BRCA,Diagnosis,Staging,Analyze the histological features in the provided whole slide image to determine the stage of the carcinoma in the right breast.,Stage 0,Stage I,Stage II,Stage III,C
778,TCGA-BH-A0E0-01Z-00-DX1,BRCA,Diagnosis,Grading,What mitotic activity score is given to the invasive ductal carcinoma in the provided whole slide image?,1,2,3,4,C
779,TCGA-BH-A0E0-01Z-00-DX1,BRCA,Microscopy,Tissue Architecture and Arrangement,Which of the following best describes the tissue architecture and arrangement observed in the provided histological section image?,The tissue shows lobular arrangement with a prominent desmoplastic stroma.,The tissue demonstrates a solid and cribriform pattern with comedo necrosis.,The tissue has a papillary growth pattern with extensive fibrosis.,The tissue exhibits a tubular pattern without significant necrosis.,B
780,TCGA-BH-A0E0-01Z-00-DX1,BRCA,Microscopy,Tumor Characteristics,"Based on the histopathological features observed in the whole slide image,which type of carcinoma in situ is admixed with the invasive ductal carcinoma in this case?",Lobular carcinoma in situ,"Solid,cribriform with comedo necrosis",Mucinous carcinoma in situ,Papillary carcinoma in situ,B
781,TCGA-BH-A0H7-01Z-00-DX1,BRCA,Diagnosis,Disease Classification,"Based on the histological features observed in the provided slide image,which of the following is the most likely diagnosis?",Infiltrating ductal carcinoma,Lobular carcinoma,Medullary carcinoma,Mucinous carcinoma,A
782,TCGA-BH-A0H7-01Z-00-DX1,BRCA,Diagnosis,Staging,"Based on the provided whole slide image,what is the T stage (pathologic) of the tumor?",pT1a,pT1b,pT1c,pT2,C
783,TCGA-BH-A0H9-01Z-00-DX1,BRCA,Diagnosis,Differential Diagnosis,"Considering the histological descriptions visible in the provided whole slide image,which condition should be part of the differential diagnosis for this case?",Fibroadenoma,Lobular carcinoma,Ductal carcinoma in situ (DCIS),Invasive ductal carcinoma,D
784,TCGA-BH-A0H9-01Z-00-DX1,BRCA,Diagnosis,Grading,"Referencing the provided whole slide image,which of the following best describes the nuclear grade of the ductal carcinoma in situ (DCIS) present in the breast tissue?",Grade 1,Grade 2,Grade 3,Grade 4,C
785,TCGA-BH-A0H9-01Z-00-DX1,BRCA,Diagnosis,Staging,"Based on the anatomical spread and dimensions observable in the provided histopathological slide,what is the pathologic T stage of the tumor?",pT1,pT2,pT3,pT4,B
786,TCGA-BH-A0H9-01Z-00-DX1,BRCA,Microscopy,Tumor Characteristics,Analyze the histological pattern visible in the provided whole slide image of invasive ductal carcinoma.,Single-file arrangement,Indian file pattern,Solid pattern,Herringbone pattern,C
787,TCGA-BH-A0HI-01Z-00-DX1,BRCA,Diagnosis,Grading,"Based on the attached whole slide image of invasive ductal carcinoma,identify the component that is assigned a score of 1 in the Nottingham grading system.",Tubule Formation,Nuclear Grade,Mitotic Activity,Lymphovascular Invasion,C
788,TCGA-BH-A0HI-01Z-00-DX1,BRCA,Clinical,Treatment Guidance,"Based on the receptor status depicted in the accompanying histological image,what adjuvant therapy would be recommended for this patient?",Trastuzumab,Tamoxifen,Cisplatin,Bevacizumab,B
789,TCGA-BH-A0HK-01Z-00-DX1,BRCA,Microscopy,Cytomorphological Characteristics,"Based on the whole slide image,which feature best describes the level of mitotic activity in the tumor?",High mitotic figures,Moderate mitotic figures,Low mitotic figures,Absent mitotic figures,C
790,TCGA-BH-A0HK-01Z-00-DX1,BRCA,Diagnosis,Disease Classification,Which histological subtype is primarily identified in this breast carcinoma diagnosis as observed in the provided whole slide image?,Lobular carcinoma,Ductal carcinoma,Medullary carcinoma,Mucinous carcinoma,A
791,TCGA-BH-A0HK-01Z-00-DX1,BRCA,Microscopy,Histopathological Changes,Which non-neoplastic histological feature can be observed in this image?,Fat necrosis,Inflammation,Fibrosis,Seborrheic keratosis,D
792,TCGA-BH-A0HK-01Z-00-DX1,BRCA,Microscopy,Tumor Characteristics,Which Tumor feature is observed in the provided whole slide image?,High nuclear pleomorphism,Lack of lymphovascular invasion,Significant tumor necrosis,Extensive perineural invasion,B
793,TCGA-BH-A0HL-01Z-00-DX1,BRCA,Diagnosis,Differential Diagnosis,"Based on the histological features observed in the provided whole slide image,which of the following would be a differential diagnosis for this breast carcinoma?",Medullary carcinoma,Invasive lobular carcinoma,Metaplastic carcinoma,Intraductal papilloma,D
794,TCGA-BH-A0HL-01Z-00-DX1,BRCA,Diagnosis,Grading,What is the nuclear grade of the carcinoma depicted in the provided whole slide image according to the Nottingham grading system?,1,2,3,4,B
795,TCGA-BH-A0HL-01Z-00-DX1,BRCA,Diagnosis,Staging,"Based on the histological and clinical findings observed in the provided whole slide image,what is the pathological T stage of the tumor?",pT1,pT2,pT3,pT4,B
796,TCGA-BH-A18J-01Z-00-DX1,BRCA,Diagnosis,Disease Classification,Evaluate the resection margins for the presence or absence of tumor involvement based on the provided whole slide image.,Positive,Negative,Indeterminate,Inconclusive,B
797,TCGA-BH-A18P-01Z-00-DX1,BRCA,Diagnosis,Disease Classification,"Based on the observed histopathological feature of comedo necrosis in the provided slide,identify the subtype of carcinoma.",Lobular carcinoma,Mucinous carcinoma,Ductal carcinoma in situ,Papillary carcinoma,C
798,TCGA-BH-A18P-01Z-00-DX1,BRCA,Microscopy,Tissue Architecture and Arrangement,What is the architectural pattern seen in the tissue section of Infiltrating Ductal Carcinoma (IDC) shown in the image?,Cribriform,Solid,Glandular,Tubular,D
799,TCGA-BH-A1EU-01Z-00-DX1,BRCA,Diagnosis,Differential Diagnosis,"Based on the visible histopathological characteristics in the provided whole slide image,which condition should be primarily considered in the differential diagnosis of this case?",Fibrocystic changes,Invasive lobular carcinoma,Ductal carcinoma in situ,Infiltrating ductal carcinoma,D
800,TCGA-BH-A1EV-01Z-00-DX1,BRCA,Diagnosis,Disease Classification,Which subtype of breast carcinoma is depicted in the provided histological image?,Comedo-type ductal carcinoma in situ,Mucinous carcinoma,Medullary carcinoma,Tubular carcinoma,A
801,TCGA-BH-A1EV-01Z-00-DX1,BRCA,Diagnosis,Grading,Which feature is indicative of poor prognosis based on the carcinoma grade in the provided whole slide image?,Poor nuclear grade,Nipple involvement,Tumor vascular space involvement,Surgical margins free of tumor,A
802,TCGA-BH-A1EV-01Z-00-DX1,BRCA,Microscopy,Histopathological Changes,Which histopathological change is least evident in the histological slide image of this case of breast carcinoma?,Tumor vascular space involvement,Extensive necrotic regions,Inflammation around tumor margins,Fibrous tissue reaction,A
803,TCGA-BH-A1EV-01Z-00-DX1,BRCA,Diagnosis,Staging,Analyze the whole slide image to determine the stage of the breast carcinoma based on the involvement of axillary lymph nodes.,Stage I,Stage II,Stage III,Stage IV,C
804,TCGA-BH-A1EY-01Z-00-DX1,BRCA,Clinical,Biomarker Analysis,How would you interpret the HER-2/NEU status of this patient's tumor based on the provided whole slide image of the immunostaining results?,Positive,Negative,Equivocal,Cannot be determined,B
805,TCGA-BH-A1EY-01Z-00-DX1,BRCA,Diagnosis,Differential Diagnosis,"Based on the histological pattern observed in the slide and the presented clinical history,which of the following could also be considered in the differential diagnosis?",DCIS (Ductal Carcinoma In Situ),Fibroadenoma,Lobular Carcinoma In Situ,Intravascular Lymphoma,A
806,TCGA-BH-A1EY-01Z-00-DX1,BRCA,Diagnosis,Grading,"Based on the provided whole slide image of the histopathological sample,what grade is the invasive ductal carcinoma?",Grade 1,Grade 2,Grade 3,Grade 4,B
807,TCGA-BH-A1EY-01Z-00-DX1,BRCA,Microscopy,Histopathological Changes,Please review the given breast carcinoma specimen and identify which histopathological change is NOT observed:,Necrosis,Inflammation,Fibrosis,Microcalcification,A
808,TCGA-BH-A1EY-01Z-00-DX1,BRCA,Diagnosis,Staging,"Based on the whole slide image,what is the stage of the disease considering no lymph nodes have been infiltrated by the tumor?",Stage 0,Stage I,Stage II,Stage III,B
809,TCGA-BH-A1EY-01Z-00-DX1,BRCA,Clinical,Treatment Guidance,Which adjuvant therapy is least likely to be recommended based on the HER-2/NEU status observed in the provided whole slide image?,Trastuzumab,Chemotherapy,Radiotherapy,Hormone Therapy,A
810,TCGA-BH-A1F8-01Z-00-DX1,BRCA,Diagnosis,Grading,"Based on the provided histopathological image,which component of the Nottingham score is assigned the highest value for the observed tumor?",Tubule formation,Nuclear grade,Mitosis,Lymphatic involvement,A
811,TCGA-BH-A1F8-01Z-00-DX1,BRCA,Diagnosis,Staging,How many lymph nodes in the provided whole slide image contained metastatic tumor?,10,11,12,13,C
812,TCGA-BH-A201-01Z-00-DX1,BRCA,Diagnosis,Grading,Evaluate the whole slide image and identify the Nottingham grade of the tumor.,Grade 1,Grade 2,Grade 3,Grade 4,B
813,TCGA-BH-A201-01Z-00-DX1,BRCA,Clinical,Prognostic Assessment,"Analyze the provided whole slide image,given a Nottingham grade 2 score for invasive ductal carcinoma,and determine the most likely prognosis.",Poor prognosis,Fair prognosis,Good prognosis,Excellent prognosis,C
814,TCGA-BH-A201-01Z-00-DX1,BRCA,Diagnosis,Staging,"Based on the provided whole slide image,determine the pathologic stage of the tumor:",pT1a pN1,pT2 pN0,pT1a pN0,pT1b pN0,C
815,TCGA-BH-A201-01Z-00-DX1,BRCA,Clinical,Treatment Guidance,"Considering the histopathological features and immunohistochemical profile depicted in the whole slide image provided,what is the most appropriate adjuvant treatment for the patient's left breast invasive ductal carcinoma?",Tamoxifen,Trastuzumab,Radiotherapy alone,Observation without further treatment,A
816,TCGA-BH-A202-01Z-00-DX1,BRCA,Microscopy,Cytomorphological Characteristics,"In a histology slide of invasive ductal carcinoma,which specific feature observed in the image is most indicative of high-grade malignancy?",Tubule formation,Nuclear pleomorphism,Mitotic activity,None of the above,C
817,TCGA-BH-A202-01Z-00-DX1,BRCA,Diagnosis,Disease Classification,Which histological type is observed in the provided whole slide image of the diagnosed invasive breast carcinoma?,Ductal carcinoma,Lobular carcinoma,Mucinous carcinoma,Medullary carcinoma,A
818,TCGA-BH-A202-01Z-00-DX1,BRCA,Diagnosis,Grading,What is the histologic feature score for nuclear pleomorphism in the Nottingham grading system as observed in the provided whole slide image?,1,2,3,4,C
819,TCGA-BH-A202-01Z-00-DX1,BRCA,Diagnosis,Staging,What is the pathologic T stage of the tumor based on the largest dimension observed in the provided whole slide image?,pT1,pT2,pT3,pT4,B
820,TCGA-BH-A203-01Z-00-DX1,BRCA,Diagnosis,Grading,"Based on the histopathological features observed in the provided whole slide image,what is the most accurate classification of the tumor grade?",Grade 1,Grade 2,Grade 3,Grade 4,C
821,TCGA-BH-A203-01Z-00-DX1,BRCA,Diagnosis,Staging,"Referencing the provided whole slide image and final diagnosis,what is the pathological stage (TNM staging) of the breast cancer?",T1 N0 M0,T1 N1 M0,T2 N2 MX,T2 N0 M0,C
822,TCGA-BH-A203-01Z-00-DX1,BRCA,Clinical,Treatment Guidance,"Based on the histopathological findings in the whole slide image,what is the appropriate first-line treatment for this patient's breast cancer?",Surgery alone,Chemotherapy followed by radiation therapy,Hormone therapy only,Radiation therapy alone,B
823,TCGA-BH-A209-01Z-00-DX1,BRCA,Diagnosis,Differential Diagnosis,"Based on the histological and clinical features observed in the provided whole slide image,what is the most plausible differential diagnosis for the breast mass?",Ductal carcinoma in situ,Invasive lobular carcinoma,Medullary carcinoma,Tubular carcinoma,C
824,TCGA-BH-A209-01Z-00-DX1,BRCA,Diagnosis,Disease Classification,"Given the final diagnosis and the histopathological features observed in the whole slide image,which subtype of breast carcinoma was identified in the biopsy?",Tubular carcinoma,Medullary carcinoma,Mucinous carcinoma,Lobular carcinoma,B
825,TCGA-BH-A209-01Z-00-DX1,BRCA,Diagnosis,Grading,What is the nuclear grade of the carcinoma observed in the provided whole slide image of the left breast mass?,High nuclear grade,Intermediate nuclear grade,Low nuclear grade,Poor nuclear grade,D
826,TCGA-BH-A209-01Z-00-DX1,BRCA,Diagnosis,Staging,"Based on the histopathological analysis of the left breast tissue sample,what is the most likely TNM stage of the carcinoma observed in the image?",T2N0M0,T1N1M0,T3N0M0,T2N2M0,A
827,TCGA-BH-A5IZ-01Z-00-DX1,BRCA,Diagnosis,Grading,"Based on the provided whole slide image of the segmental mastectomy specimen,what is the Nottingham grade for the invasive ductal carcinoma?",Grade 1,Grade 2,Grade 3,Not Determined,C
828,TCGA-BH-A5IZ-01Z-00-DX1,BRCA,Diagnosis,Staging,"Based on the whole slide image provided,what is the pathologic stage (pT and pN) of the primary invasive carcinoma?","pT1,pN0","pT2,pN1a","pT2,pN0","pT3,pN1a",B
829,TCGA-BH-A5J0-01Z-00-DX1,BRCA,Diagnosis,Grading,"Based on the whole slide image provided,what is the Nottingham grade for the diagnosed invasive ductal carcinoma?",Grade 1,Grade 2,Grade 3,Grade 4,B
830,TCGA-BH-A5J0-01Z-00-DX1,BRCA,Diagnosis,Staging,"Based on the given whole slide image of the breast tissue,what pathologic TNM stage is assigned to the primary invasive carcinoma?",pT1a pN0,pT1b pN1,pT1c pN0,pT2 pN1,C
831,TCGA-BT-A20W-01Z-00-DX1,BLCA,Diagnosis,Staging,What TNM stage is assigned to the urothelial carcinoma in the bladder based on the provided whole slide image?,T1 NO MX,T2a NO MX,T2b NO MX,T3 NO MX,C
832,TCGA-BT-A42B-01Z-00-DX1,BLCA,Diagnosis,Disease Detection,"Based on the examination of the provided whole slide image of the excised lymph nodes from the right pelvic region (Part 4),is there any evidence of carcinoma present?","Yes,metastatic carcinoma is present","No,all lymph nodes are benign",One lymph node shows carcinoma,Lymph nodes show signs of inflammation,B
833,TCGA-BT-A42B-01Z-00-DX1,BLCA,Microscopy,Histopathological Changes,Examine the provided whole slide image to identify the histopathological feature indicative of tumor necrosis in high-grade urothelial carcinoma.,Dense inflammatory infiltrate,Coagulative necrosis with nuclear debris,Increased mucin production,Fibrous stroma development,B
834,TCGA-BT-A42B-01Z-00-DX1,BLCA,Diagnosis,Staging,"Based on the provided histological image of the urinary bladder tumor,which feature is indicative of an advanced stage in the staging?",Invasion into lamina propria,Involvement of detrusor muscle,Perivesical fat extension,Intramural involvement only,C
835,TCGA-BT-A42B-01Z-00-DX1,BLCA,Microscopy,Tissue Architecture and Arrangement,Examine the given whole slide image. What architectural pattern do you observe in high-grade urothelial carcinoma?,Papillary structures,Solid nests,Flat sheets,Glandular formations,A
836,TCGA-BT-A42E-01Z-00-DX1,BLCA,Diagnosis,Grading,Examine the provided whole slide image and identify the grade of a tumor that shows features of lymphoepithelioma-like carcinoma with regions of squamous differentiation.,Low-grade urothelial carcinoma,Medium-grade urothelial carcinoma,High-grade urothelial carcinoma,Grade cannot be determined,C
837,TCGA-BT-A42E-01Z-00-DX1,BLCA,Diagnosis,Staging,"What is the pathologic stage of a tumor shown in the provided whole slide image,considering it has no lymphovascular invasion and negative surgical margins?",pT1,pT2,pT3,pT4,C
838,TCGA-C4-A0F1-01Z-00-DX1,BLCA,Microscopy,Tissue Architecture and Arrangement,"Given the histological slide of moderately differentiated urothelial carcinoma,what architectural features are observed?",Regular arrangement of cells with orderly layers,Disorganized cell layers with invasion into surrounding structures,Simple columnar epithelial layers with no invasion,Stratified squamous epithelium without any dysplasia,B
839,TCGA-CK-5916-01Z-00-DX1,COAD,Diagnosis,Disease Classification,"Based on the histological features observed in the provided whole slide image,what is the primary diagnosis?",Adenocarcinoma of the colon,Gastrointestinal stromal tumor,Crohn's disease,Diverticulosis,A
840,TCGA-CK-5916-01Z-00-DX1,COAD,Diagnosis,Grading,"Based on the whole slide image provided,what is the grade of the tumor?",Well differentiated,Moderately differentiated,Poorly differentiated,Undifferentiated,C
841,TCGA-CK-5916-01Z-00-DX1,COAD,Diagnosis,Staging,"Based on the examination of the provided whole slide image,what is the stage of the adenocarcinoma?",Stage 0,Stage I,Stage II,Stage III,D
842,TCGA-CM-4752-01Z-00-DX1,COAD,Clinical,Prognostic Assessment,What complication can you identify in this whole slide image that is crucial in determining the prognosis for a right-sided colon adenocarcinoma invading into the subserosa?,Vascular invasion,Serosal involvement,Lymph node metastasis,Perineural invasion,D
843,TCGA-CM-5344-01Z-00-DX1,COAD,Microscopy,Tissue Architecture and Arrangement,What is the observed architecture of the tumor in the sigmoid colon based on the provided whole slide image?,Tubular,Villous,Tubulovillous,Solid,A
844,TCGA-CM-5349-01Z-00-DX1,COAD,Microscopy,Tumor Characteristics,Which histopathological feature is highlighted in the provided whole slide image for diagnosing colon adenocarcinoma?,Presence of mucin-secreting cells.,Glandular formation by tumor cells.,Lymphocyte infiltration in the stroma.,Extensive necrosis within the tissue.,B
845,TCGA-CM-5862-01Z-00-DX1,COAD,Diagnosis,Disease Classification,Identify the type of polyp seen in the provided slide along with the adenocarcinoma.,Villous adenoma,Serrated polyp,Tubular adenoma,Juvenile polyp,C
846,TCGA-CM-5862-01Z-00-DX1,COAD,Diagnosis,Staging,"Based on the provided whole slide image and using the AJCC 7th Edition criteria,what is the stage of the tumor?",pT1,pT2,pT3,pT4,C
847,TCGA-CM-5868-01Z-00-DX1,COAD,Diagnosis,Disease Detection,Review the whole slide image of the sigmoid colon resection specimen and determine if there is any evidence of perineural invasion.,"Yes,identified","No,not identified","Possibly present,not confirmed",Indeterminate,A
848,TCGA-CM-5868-01Z-00-DX1,COAD,Diagnosis,Staging,"Based on the provided histopathological image,what is the AJCC stage of the tumor in the sigmoid colon?",pT2,pT3,pT4a,pT1,C
849,TCGA-CM-6163-01Z-00-DX1,COAD,Microscopy,Histopathological Changes,Which histopathological change is not identifiable in the whole slide image of this case of sigmoid colon adenocarcinoma?,Necrosis,Diverticulosis,Tumor budding,Inflammation,C
