ID,Slide,Tumor,Broad Category,Narrow Category,Question,A,B,C,D,Answer
1035,TCGA-DU-A5TU-01Z-00-DX1,LGG,Diagnosis,Disease Classification,"Based on the histological features observed in the provided whole slide image,what is the likely diagnosis?",Glioblastoma Multiforme,Oligodendroglioma,"Astrocytoma,WHO grade 2",Ependymoma,C
1036,TCGA-DU-A5TU-01Z-00-DX1,LGG,Microscopy,Histopathological Changes,"According to the examination of the whole slide image of this astrocytoma,which histopathological feature is specifically absent?",Endothelial hyperplasia,Microvascular cellular proliferation,Chronic inflammation,Tumor necrosis,D
1037,TCGA-DU-A5TU-01Z-00-DX1,LGG,Microscopy,Tissue Architecture and Arrangement,Examine the provided whole slide image of the astrocytoma. Which statement best characterizes the cellular arrangement?,Cells display a high degree of nuclear pleomorphism and multinucleation,Cells form well-defined glandular structures,Cells infiltrate diffusely without forming distinct masses,Cells are arranged in sheets with frequent mitosis,C
1038,TCGA-DU-A5TU-01Z-00-DX1,LGG,Microscopy,Tumor Characteristics,"Which feature is absent in this astrocytoma slide,suggesting it is less likely to be a higher-grade tumor?",Endothelial hyperplasia,Microvascular cellular proliferation,Absence of mitotic figures,Tumor necrosis,D
1039,TCGA-DU-A6S2-01Z-00-DX1,LGG,Microscopy,Cytomorphological Characteristics,Which cytomorphological feature is regularly seen in the neoplastic cells of the tumor visible in the medial frontal lobe of the provided slide image?,Nuclear pleomorphism and hyperchromasia.,Uniform nuclei with fine chromatin and perinuclear clearing.,Prominent nucleoli and abundant eosinophilic cytoplasm.,Multinucleation and cytoplasmic vacuolation.,B
1040,TCGA-DU-A6S2-01Z-00-DX1,LGG,Diagnosis,Disease Classification,Analyze the histological features visible in the provided whole slide image and determine which condition the brain lesion corresponds to according to the WHO classification.,Meningioma,Oligodendroglioma (WHO Grade II),Metastatic carcinoma,Pilocytic astrocytoma,B
1041,TCGA-DU-A6S2-01Z-00-DX1,LGG,Microscopy,Tumor Characteristics,"Analyzing the medial frontal tumor slide,which characteristic supports the diagnosis of oligodendroglioma?",Presence of perinuclear halos.,Extensive necrosis.,High-grade nuclear pleomorphism.,Endothelial cell proliferation.,A
1042,TCGA-DU-A6S3-01Z-00-DX1,LGG,Microscopy,Tissue Architecture and Arrangement,"Based on the provided whole slide image,which histopathological feature is NOT typically associated with oligodendroglioma?",Microvascular proliferation,Low mitotic activity,Diffuse infiltration,"1p,19q co-deletion",A
1043,TCGA-DU-A6S7-01Z-00-DX1,LGG,Diagnosis,Disease Classification,What histological diagnosis do the features observed in the brain left frontal craniotomy image most likely indicate?,Glioblastoma multiforme,"Anaplastic astrocytoma,WHO grade 3",Oligodendroglioma,"Diffuse astrocytoma,WHO grade 2",B
1044,TCGA-DU-A6S7-01Z-00-DX1,LGG,Diagnosis,Grading,Examine the provided whole slide image and determine the grade of the tumor based on the visible histopathological features.,WHO grade 1,WHO grade 2,WHO grade 3,WHO grade 4,C
1045,TCGA-DU-A76R-01Z-00-DX1,LGG,Diagnosis,Disease Classification,"Based on the analysis of the provided whole slide image and the associated clinical features,what is the most likely diagnosis for the patient's brain tumor in part A?",Oligodendroglioma,Astrocytoma,Meningioma,Neurocytoma,A
1046,TCGA-DU-A76R-01Z-00-DX1,LGG,Microscopy,Histopathological Changes,Which histopathological change can be observed in the whole slide image of an oligodendroglioma?,Dense fibrous stroma,Inflammation,Calcifications,Elastic fiber proliferation,C
1047,TCGA-DU-A76R-01Z-00-DX1,LGG,Diagnosis,Staging,"Based on the provided whole slide image of the brain tumor,what stage would you assign if it shows local extension but no distant metastasis?",Stage I,Stage II,Stage III,Stage IV,C
1048,TCGA-DU-A7T8-01Z-00-DX1,LGG,Microscopy,Cytomorphological Characteristics,"Based on the provided histological image of the glioma cells,which cytological characteristic is NOT observed?",Round nuclei,Pleomorphism,Abundant mitotic figures,Microcystic background,C
1049,TCGA-DU-A7T8-01Z-00-DX1,LGG,Microscopy,Histopathological Changes,Which histopathological change is NOT observed in the provided whole slide image of a glioma with atypical features?,Necrosis,Microcystic change,Inflammation,Minimal fibrosis,A
1050,TCGA-DU-A7T8-01Z-00-DX1,LGG,Microscopy,Tissue Architecture and Arrangement,Analyze the histological features observed in the excisional biopsy from the right frontal brain. Identify the feature that is NOT present in the image.,"Round,somewhat pleomorphic neoplastic cells",Dense fibrotic stroma,Mucious background,Microcystic change,B
1051,TCGA-DU-A7TI-01Z-00-DX1,LGG,Diagnosis,Grading,"Based on the morphological features observed in the cellular and structural composition of Specimen B,what is the most likely grade for the tumor?",Grade I,Grade II,Grade III,Grade IV,C
1052,TCGA-DU-A7TI-01Z-00-DX1,LGG,Microscopy,Histopathological Changes,"Which histopathological change,as observed in the provided whole slide image of specimen C,is absent?",Necrosis.,Microvascular cellular proliferation.,Mitoses.,All of the above.,D
1053,TCGA-DU-A7TI-01Z-00-DX1,LGG,Diagnosis,Staging,What is the stage of the neoplasm observed in Specimen B based on its histological features and the involvement of deep tissues as seen in the image?,Stage I,Stage II,Stage III,Stage IV,C
1054,TCGA-DU-A7TI-01Z-00-DX1,LGG,Microscopy,Tissue Architecture and Arrangement,"Based on the analysis of the Whole Slide Image for specimen A,how would you best describe the observed tissue architecture and arrangement?",A solid tumor mass with irregular borders and regions of necrosis.,Diffuse infiltration of cerebral cortex and adjacent white matter by glial cells.,A formal structured lobular arrangement with distinct boundaries.,Predominantly necrotic tissue with sparse viable cells.,B
1055,TCGA-E1-A7YE-01Z-00-DX1,LGG,Diagnosis,Disease Classification,What specific type of glioma can be identified in the provided whole slide image based on its histological features?,Pilocytic Astrocytoma,Oligoastrocytoma,Anaplastic Astrocytoma,Glioblastoma,C
1056,TCGA-E1-A7YE-01Z-00-DX1,LGG,Diagnosis,Grading,"Based on the visual characteristics observed in this whole slide image,including high cellularity and pleomorphism of astrocytes,what WHO grade would be appropriate?",Grade I,Grade II,Grade III,Grade IV,C
1057,TCGA-E1-A7YE-01Z-00-DX1,LGG,Clinical,Treatment Guidance,"Examine the provided whole slide image. Based on the histopathological features observed,which treatment option is most appropriate for the patient?",Surgical resection followed by radiotherapy,Chemotherapy alone,Watchful waiting and regular monitoring,Antibiotics and conservative management,A
1058,TCGA-E1-A7YY-01Z-00-DX1,LGG,Diagnosis,Differential Diagnosis,"Given the histological features observed in the provided whole slide image,which of the following is least likely to be a differential diagnosis for the brain tumor?",Well-Differentiated Oligodendroglioma,Glioblastoma,Pilocytic Astrocytoma,Anaplastic Oligodendroglioma,C
1059,TCGA-E1-A7YY-01Z-00-DX1,LGG,Diagnosis,Disease Classification,"Based on the microscopic features and visual analysis of the provided whole slide image,which diagnosis is most likely for the right frontal brain tumor?",Glioblastoma,Well-Differentiated Oligodendroglioma,Meningioma,"Astrocytoma,Low Grade",B
1060,TCGA-E2-A105-01Z-00-DX1,BRCA,Diagnosis,Differential Diagnosis,Which of the following could be a differential diagnosis for the right breast carcinoma based on the whole slide image's morphological features?,Invasive Lobular Carcinoma,Invasive Cribriform Carcinoma,Tubulolobular Carcinoma,Medullary Carcinoma,A
1061,TCGA-E2-A105-01Z-00-DX1,BRCA,Diagnosis,Disease Classification,"Based on the histological features observed under the microscope and relevant clinical information,what is the likely diagnosis for the right breast lumpectomy sample depicted in the provided whole slide image?","Invasive Mammary Carcinoma,Tubulolobular Type",Invasive Ductal Carcinoma,Lobular Carcinoma In Situ,Mixed Ductal and Lobular Carcinoma,A
1062,TCGA-E2-A105-01Z-00-DX1,BRCA,Diagnosis,Grading,"Based on the microscopic features observed in the whole slide image of the right breast lumpectomy,what is the grade of the invasive carcinoma?",Grade I,Grade II,Grade III,Grade IV,A
1063,TCGA-E2-A105-01Z-00-DX1,BRCA,Diagnosis,Staging,What is the stage of the left breast carcinoma according to TNM classification based on the provided pathological image?,pT1a N0,pT1b N0,pT2 N0,pT3 N0,C
1064,TCGA-E2-A105-01Z-00-DX1,BRCA,Microscopy,Tissue Architecture and Arrangement,How is the ductal carcinoma in situ (DCIS) in the left breast lumpectomy specimen characterized based on the histological features observed in the slide?,"High nuclear grade,solid type","High nuclear grade,cribriform type","Intermediate nuclear grade,solid type","Low nuclear grade,micropapillary type",C
1065,TCGA-E2-A105-01Z-00-DX1,BRCA,Microscopy,Tumor Characteristics,"Based on the provided whole slide image of the right breast tumor,identify the most frequent type of carcinoma in situ associated with the invasive tumor:","Low nuclear grade,solid type","Intermediate nuclear grade,cribriform type","High nuclear grade,solid type","Low nuclear grade,micropapillary type",A
1066,TCGA-E2-A10A-01Z-00-DX1,BRCA,Microscopy,Histopathological Changes,Which feature is NOT observed in the histological image of the subcutaneous section of the skin from the left breast mastectomy?,Tumor infiltration,Normal breast parenchyma,Fibrous tissue,Normal skin tissue,A
1067,TCGA-E2-A10A-01Z-00-DX1,BRCA,Microscopy,Tumor Characteristics,"Based on the provided whole slide image of the left breast mastectomy specimen,identify the type of carcinoma in-situ associated with the invasive ductal carcinoma observed.",Lobular carcinoma in-situ,Cribriform carcinoma in-situ,Papillary carcinoma in-situ,Mucinous carcinoma in-situ,B
1068,TCGA-E2-A14V-01Z-00-DX1,BRCA,Clinical,Prognostic Assessment,"Based on the provided whole slide image of invasive ductal carcinoma,which factor is most predictive of a poor prognosis?",Tumor size,HER2 status,Lymphovascular invasion,Margin status,C
1069,TCGA-E2-A14V-01Z-00-DX1,BRCA,Clinical,Treatment Guidance,"Which treatment is least appropriate for the condition shown in the image,which features ductal carcinoma in situ (DCIS) with microcalcifications and necrosis,close to surgical margins?",Wide local excision,Mastectomy,Radiation therapy,Hormone therapy,D
1070,TCGA-E2-A152-01Z-00-DX1,BRCA,Microscopy,Histopathological Changes,Which histopathological feature is observed in relation to the biopsy site alterations in the right breast mass as seen in the accompanying whole slide image?,Dense fibrosis,Extensive necrosis,Chronic inflammation,Lymphovascular invasion,A
1071,TCGA-E2-A152-01Z-00-DX1,BRCA,Diagnosis,Staging,"Based on your observation of the whole slide image and pathological staging (pTN),what is the T stage of the tumor?",pT1a,pT1b,pT1c,pT2,C
1072,TCGA-E2-A152-01Z-00-DX1,BRCA,Microscopy,Tissue Architecture and Arrangement,What is the predominant tissue architecture in the invasive ductal carcinoma observed in the provided whole slide image?,Glandular pattern surrounded by abundant stroma,Solid nests and sheets of cells,Papillary structures lined by epithelial cells,Single file arrangement of cells,B
1073,TCGA-E2-A153-01Z-00-DX1,BRCA,Diagnosis,Disease Classification,"Based on the histological features observed in the provided whole slide image of the right breast specimen,what type of carcinoma is present?",Lobular Carcinoma in Situ,Invasive Ductal Carcinoma,Medullary Carcinoma,Papillary Carcinoma,A
1074,TCGA-E2-A153-01Z-00-DX1,BRCA,Diagnosis,Grading,What is the grade of the invasive ductal carcinoma observed in the left breast tissue slide image?,Grade 1,Grade 2,Grade 3,Not Applicable,B
1075,TCGA-E2-A15H-01Z-00-DX1,BRCA,Diagnosis,Disease Classification,Which histopathological patterns characteristic of ductal carcinoma in situ (DCIS) subtype are visible in the provided whole slide image?,Papillary,Micropapillary,Solid and Cribriform,Comedo,C
1076,TCGA-E2-A15H-01Z-00-DX1,BRCA,Diagnosis,Grading,What grade is assigned to the invasive ductal carcinoma according to the Scarff-Bloom-Richardson grading system based on the provided whole slide image?,Grade 1,Grade 2,Grade 3,Grade 4,B
1077,TCGA-E2-A15H-01Z-00-DX1,BRCA,Microscopy,Histopathological Changes,Examine the provided lymph node slide. Which pathological change is most likely observed?,Hemorrhage,Granulomatous inflammation,Lymphocyte depletion,Tumor cell clusters,D
1078,TCGA-E2-A15H-01Z-00-DX1,BRCA,Diagnosis,Staging,"Based on the histopathologic features observed in the provided whole slide image of the breast tissue,what is the pathologic stage of the breast cancer?",pT1a N0,pT1b N0,pT1c N1a,pT2 N1,C
1079,TCGA-E2-A15H-01Z-00-DX1,BRCA,Clinical,Treatment Guidance,"Based on the analysis of the whole slide image,which shows the presence of invasive tumor on the surgical resection margin,what is the next likely step in the patient's treatment plan?",No further treatment required,Additional surgical resection,Radiation therapy,Initiate palliative care,B
1080,TCGA-E2-A15H-01Z-00-DX1,BRCA,Microscopy,Tumor Characteristics,Which architectural pattern is typically observed in the provided whole slide image of infiltrating ductal carcinoma?,Cribriform pattern,Indian file pattern,Glandular/acinar formation,Trabecular pattern,C
1081,TCGA-E2-A1B5-01Z-00-DX1,BRCA,Diagnosis,Differential Diagnosis,What is the most likely diagnosis based on the cellular morphology and architectural patterns seen in the provided slides?,Invasive ductal carcinoma,Sclerosing adenosis,Fibrocystic changes,Pleomorphic lobular carcinoma in situ,D
1082,TCGA-E2-A1B5-01Z-00-DX1,BRCA,Diagnosis,Disease Classification,Which classification best matches the tumor morphology observed in the provided slide image?,Classic Invasive Lobular Carcinoma,Solid Variant Invasive Lobular Carcinoma,Pleomorphic Invasive Lobular Carcinoma,Tubulolobular Carcinoma,C
1083,TCGA-E2-A1B5-01Z-00-DX1,BRCA,Diagnosis,Grading,"According to the Modified Scarff Bloom Richardson Grade,what grade is the tumor in the provided whole slide image of the wide local excision of the left breast?",Grade 1,Grade 2,Grade 3,Grade 4,B
1084,TCGA-E2-A1B5-01Z-00-DX1,BRCA,Diagnosis,Staging,"Based on the cellular and tissue characteristics observed in the provided whole slide image,what is the pathological staging (pTN) of the left breast invasive lobular carcinoma?",pT1N0,pT2N1,pT2N0,pT3N0,C
1085,TCGA-E2-A1IE-01Z-00-DX1,BRCA,Diagnosis,Disease Classification,"Which sentinel lymph node in the right axilla,as seen in the provided whole slide images,showed micrometastatic carcinoma?",Sentinel Lymph Node #1,Sentinel Lymph Node #2,Sentinel Lymph Node #3,None of the above,B
1086,TCGA-E2-A1IE-01Z-00-DX1,BRCA,Diagnosis,Grading,"Based on the provided whole slide image,what is the Scarff-Bloom-Richardson (SBR) grade assigned to the invasive ductal carcinoma?",Grade 1,Grade 2,Grade 3,Grade 4,B
1087,TCGA-E2-A1IE-01Z-00-DX1,BRCA,Diagnosis,Staging,Analyze the whole slide image of the right breast to determine the clinical stage assigned to the invasive ductal carcinoma.,Stage I,Stage II,Stage III,Stage IV,B
1088,TCGA-E2-A1IH-01Z-00-DX1,BRCA,Diagnosis,Differential Diagnosis,"Based on the cellular morphology and architectural patterns observed in the provided histological slide of the left breast mass,what is the most likely differential diagnosis?",Invasive Ductal Carcinoma,Ductal Carcinoma In Situ,Invasive Lobular Carcinoma,Fibroadenoma,C
1089,TCGA-E2-A1IH-01Z-00-DX1,BRCA,Diagnosis,Disease Classification,"Based on the histological features observed in the provided whole slide image of the invasive breast carcinoma,what is the likely type of carcinoma?",Invasive Ductal Carcinoma,Invasive Lobular Carcinoma,Mucinous Carcinoma,Medullary Carcinoma,B
1090,TCGA-E2-A1IH-01Z-00-DX1,BRCA,Diagnosis,Grading,What grade is assigned to the invasive lobular carcinoma in the provided whole slide image based on the Scarff-Bloom-Richardson (SBR) grading system?,Grade 1,Grade 2,Grade 3,Grade 4,B
1091,TCGA-E2-A1IH-01Z-00-DX1,BRCA,Diagnosis,Staging,"Based on the provided whole slide image,what is the pathological stage (pTN) assigned to the invasive lobular carcinoma?",pT2 N1,pT1c N0,pT1a N0,pT1b N1,B
1092,TCGA-E2-A1IH-01Z-00-DX1,BRCA,Clinical,Treatment Guidance,"Based on the histological features observed in the whole slide image and the absence of lymphovascular invasion and negative lymph nodes,what is the next best treatment recommendation?",Additional surgery,Radiation therapy,Adjuvant hormonal therapy,Chemotherapy,C
1093,TCGA-E2-A1IL-01Z-00-DX1,BRCA,Diagnosis,Disease Classification,"Based on the histological features observed in the provided breast tissue whole slide image,what is the primary diagnosis?",Invasive lobular carcinoma,Invasive ductal carcinoma,Fibroadenoma,Mucinous carcinoma,A
1094,TCGA-E2-A1IL-01Z-00-DX1,BRCA,Diagnosis,Grading,"Based on the histopathological features observed in the whole slide image of the left breast,what grade would you assign to the invasive lobular carcinoma?",Grade I (low grade),Grade II (intermediate grade),Grade III (high grade),Cannot be determined,B
1095,TCGA-E2-A1L7-01Z-00-DX1,BRCA,Diagnosis,Disease Classification,Analyze the provided histological images to identify the specific type of ductal carcinoma in situ (DCIS) presented.,Comedo type,Cribriform type,Solid type,Papillary type,C
1096,TCGA-E2-A1L7-01Z-00-DX1,BRCA,Diagnosis,Staging,Review the provided whole slide image and determine the most appropriate pathological stage (pTN) for this case:,pT1 N0,pT2 N2,pT3 N1,pT2 N1,B
1097,TCGA-E2-A1LA-01Z-00-DX1,BRCA,Diagnosis,Disease Detection,"Based on the provided whole slide image,identify the presence and extent of metastases in the axillary lymph nodes:","Yes,in all lymph nodes","Yes,in one sentinel lymph node","Yes,in some axillary lymph nodes","No,there are no metastases",B
1098,TCGA-E2-A1LA-01Z-00-DX1,BRCA,Diagnosis,Grading,"Based on the whole slide image,what is the histologic grade of the invasive ductal carcinoma according to the Modified Scarff Bloom Richardson system?",Grade 1,Grade 2,Grade 3,Grade 4,B
1099,TCGA-E2-A1LA-01Z-00-DX1,BRCA,Microscopy,Tissue Architecture and Arrangement,Refer to the specific arrangement of cells seen in the provided whole slide image of invasive ductal carcinoma. Which term best describes this arrangement?,Haphazard,Tubular,Solid,Papillary,B
1100,TCGA-E2-A1LI-01Z-00-DX1,BRCA,Diagnosis,Disease Classification,"Based on the histological features observed in sentinel lymph node #1,what is the most likely diagnosis?",Metastatic Carcinoma,Reactive Lymph Node Hyperplasia,No Tumor Seen,Suspicious for Malignancy,C
1101,TCGA-E2-A1LI-01Z-00-DX1,BRCA,Diagnosis,Grading,"Based on the provided whole slide image,what is the SBR (Scarff-Bloom-Richardson) grade of the tumor?",I,II,III,IV,C
1102,TCGA-E2-A1LI-01Z-00-DX1,BRCA,Diagnosis,Staging,Refer to the provided whole slide image to determine the tumor size category of the invasive ductal carcinoma:,T1,T2,T3,T4,B
1103,TCGA-E2-A1LS-01Z-00-DX1,BRCA,Diagnosis,Differential Diagnosis,Refer to the histological features observed in the subareolar lesion of the breast tissue to determine which conditions should be included in the differential diagnosis.,"Paget's disease,DCIS,ductal papilloma,sclerosing adenosis","Fibroadenoma,papilloma,LCIS,DCIS","Intraductal papilloma,DCIS,fibrocystic changes,invasive ductal carcinoma","DCIS,LCIS,fibroadenoma,fat necrosis",C
1104,TCGA-E2-A1LS-01Z-00-DX1,BRCA,Diagnosis,Disease Classification,Identify the type of ductal carcinoma in situ (DCIS) present in the provided whole slide image of the right breast mastectomy.,Micropapillary,Solid,Cribriform,Comedo,B
1105,TCGA-E2-A1LS-01Z-00-DX1,BRCA,Diagnosis,Grading,Evaluate the nuclear grade of the ductal carcinoma in situ (DCIS) present in the provided whole slide image of the right breast.,Low,Intermediate,High,Very High,B
1106,TCGA-E2-A1LS-01Z-00-DX1,BRCA,Microscopy,Histopathological Changes,Which histopathological finding is present in the provided image of the benign subareolar tissue of the right breast?,Apocrine metaplasia,Usual ductal hyperplasia,Intraductal papilloma,Tubular adenoma,C
1107,TCGA-E2-A1LS-01Z-00-DX1,BRCA,Diagnosis,Staging,What is the pathological staging of the invasive ductal carcinoma in the right breast as per AJCC Cancer Staging Manual based on the provided whole slide image?,pT1a N0,pT1b N1,pT1c N0,pT1c N1,C
1108,TCGA-E2-A1LS-01Z-00-DX1,BRCA,Microscopy,Tissue Architecture and Arrangement,"Based on the whole slide image provided,what is the overall tissue architecture observed in the right breast subareolar region?",Presence of nodular collagenous stroma without an organized structure,Intraductal papilloma with fibrovascular cores lined by epithelial cells,Dense fibrotic tissue with scattered lymphoid aggregates,Diffuse adipose tissue without ductal structures,B
1109,TCGA-E2-A1LS-01Z-00-DX1,BRCA,Microscopy,Tumor Characteristics,Which feature is specific to the invasive ductal carcinoma described in the right breast based on the provided slide image?,Presence of necrosis within the tumor,Well-circumscribed margins with ductal differentiation,Lymphovascular invasion within surrounding tissue,Intermediate nuclear grade with solid patterns in ducts,D
1110,TCGA-E2-A3DX-01Z-00-DX1,BRCA,Diagnosis,Disease Classification,"Based on the histological features observed in the provided whole slide image of the right breast,what is the likely diagnosis for the primary tumor?",Invasive Ductal Carcinoma,Invasive Lobular Carcinoma,Mucinous Carcinoma,Medullary Carcinoma,B
1111,TCGA-E2-A3DX-01Z-00-DX1,BRCA,Diagnosis,Grading,"Based on the microscopic analysis of the provided whole slide image of the patient's invasive tumor and using the modified Scarff Bloom Richardson grade,what is the grade of the tumor?",Grade 1,Grade 2,Grade 3,Grade 4,B
1112,TCGA-E2-A3DX-01Z-00-DX1,BRCA,Diagnosis,Staging,"Based on the whole slide image,what is the pathological stage of the disease according to the AJCC Cancer Staging Manual,7th Edition?",pT1 N1,pT2 N3,pT2 N1,pT3 N2,B
1113,TCGA-E2-A3DX-01Z-00-DX1,BRCA,Clinical,Treatment Guidance,"Based on the histopathological features observed in the whole slide image,what is the most appropriate systemic treatment option for this patient?",Hormonal therapy alone,Chemotherapy and hormonal therapy,Radiation therapy alone,Observation without systemic treatment,B
1114,TCGA-E2-A56Z-01Z-00-DX1,BRCA,Clinical,Treatment Guidance,Which treatment option is most appropriate for the patient with the specific invasive ductal carcinoma characteristics shown in the provided whole slide image?,Tamoxifen,Trastuzumab (Herceptin),Chemotherapy,Surgery alone,A
1115,TCGA-E2-A570-01Z-00-DX1,BRCA,Diagnosis,Disease Classification,"Based on the whole slide image analysis of the sentinel lymph node #2 from the right axilla,what is the diagnosis?",One lymph node positive for metastatic carcinoma,Two lymph nodes negative for metastatic carcinoma,Lymph nodes negative for any abnormalities,Lymphoma,B
1116,TCGA-E2-A570-01Z-00-DX1,BRCA,Diagnosis,Grading,What is the grade of the invasive ductal carcinoma observed in the provided whole slide image of the right breast?,Grade 1,Grade 2,Grade 3,Grade 4,A
1117,TCGA-E2-A570-01Z-00-DX1,BRCA,Diagnosis,Staging,What is the pathological staging for the right breast carcinoma based on the provided whole slide image?,pT1a N0,pT1b N1,pT1c N1mi,pT2 N1,C
1118,TCGA-E7-A3Y1-01Z-00-DX1,BLCA,Diagnosis,Disease Detection,Examine the whole slide image and identify if there is any histological evidence of venous invasion in the tumor tissue.,"Yes,there is significant venous invasion","Yes,there is mild venous invasion","No,venous invasion is absent",It cannot be determined from the provided information,C
1119,TCGA-E7-A3Y1-01Z-00-DX1,BLCA,Diagnosis,Grading,What is the histologic grade of the transitional cell carcinoma observed in the provided whole slide image?,Well differentiated,Moderately differentiated,Poorly differentiated,Cannot be determined,B
1120,TCGA-E7-A3Y1-01Z-00-DX1,BLCA,Microscopy,Tissue Architecture and Arrangement,"In the provided histological section of the bladder,which feature,when observed,would indicate a superficial muscle layer invasion by a transitional cell carcinoma?",Presence of tumor cells within the lamina propria,Infiltration of tumor cells into the outer half of the muscle layer,Invasion of tumor cells limited to the inner half of the muscle layer,Tumor cells restricted to the urothelial surface,C
1121,TCGA-E7-A5KE-01Z-00-DX1,BLCA,Microscopy,Cytomorphological Characteristics,What cytoplasmic feature can be identified in the tumor cells observed in the slide image?,Basophilic,Eosinophilic,Vacuolated,Hyalinized,B
1122,TCGA-E7-A677-01Z-00-DX1,BLCA,Microscopy,Cytomorphological Characteristics,Observe the cytoplasmic characteristic in the tumor cells presented in the slide image.,Basophilic,Eosinophilic,Clear,Vacuolated,B
1123,TCGA-E7-A677-01Z-00-DX1,BLCA,Diagnosis,Grading,"Based on the histopathological features observed in the provided whole slide image,what is the grade of the identified urothelial carcinoma?",High-grade,Moderately differentiated,Poorly differentiated,Well differentiated,B
1124,TCGA-E7-A677-01Z-00-DX1,BLCA,Diagnosis,Staging,What stage is assigned to the urothelial carcinoma based on the specific characteristics seen in the muscularis propria of the provided whole slide image?,T1,T2a,T2b,T3,C
